<?xml version="1.0" encoding="utf-8"?>
<!ELEMENT config (categories?, breaking.changes?)>
<!ATTLIST config version CDATA #REQUIRED>

<!ELEMENT categories (entry*)>
<!ELEMENT breaking.changes (entry*)>

<!ELEMENT entry ANY>