<?xml version="1.0" encoding="utf-8"?>
<!DOCTYPE config SYSTEM "config.v1.dtd">
<config version="1">
    <categories>
        <entry>api</entry>
        <entry>core</entry>
        <entry>instructions</entry>
    </categories>
    <breaking.changes>
        <entry>major</entry>
        <entry>minor</entry>
        <entry>trivial</entry>
    </breaking.changes>
</config>